{
  "generatedAt": "2026-03-03T00:41:25.519Z",
  "version": "1.0",
  "totalRecords": 119,
  "contradictions": [],
  "records": [
    {
      "id": "ADR-001",
      "title": "Backend Runtime Choice",
      "status": "accepted",
      "decisionDate": "2026-03-02",
      "scope": "platform",
      "domain": "core",
      "path": "docs/adr/core/ADR-001-backend-runtime-choice.md",
      "sourceArtifact": "ADR 001 backend runtime choice",
      "dependsOn": [],
      "supersedes": [],
      "supersededBy": [],
      "conflictsWith": [],
      "statusGate": "adr governance"
    },
    {
      "id": "ADR-002",
      "title": "Admissions State Machine",
      "status": "accepted",
      "decisionDate": "2026-03-02",
      "scope": "platform",
      "domain": "core",
      "path": "docs/adr/core/ADR-002-admissions-state-machine.md",
      "sourceArtifact": "ADR 002 admissions state machine",
      "dependsOn": [],
      "supersedes": [],
      "supersededBy": [],
      "conflictsWith": [],
      "statusGate": "adr governance"
    },
    {
      "id": "ADR-003",
      "title": "Document Lifecycle and Attachment Governance",
      "status": "accepted",
      "decisionDate": "2026-03-02",
      "scope": "platform",
      "domain": "core",
      "path": "docs/adr/core/ADR-003-document-lifecycle.md",
      "sourceArtifact": "ADR 003 document lifecycle",
      "dependsOn": [],
      "supersedes": [],
      "supersededBy": [],
      "conflictsWith": [],
      "statusGate": "adr governance"
    },
    {
      "id": "ADR-004",
      "title": "API Client and OAuth Lifecycle",
      "status": "accepted",
      "decisionDate": "2026-03-02",
      "scope": "platform",
      "domain": "core",
      "path": "docs/adr/core/ADR-004-api-client-governance.md",
      "sourceArtifact": "ADR 004 api client governance",
      "dependsOn": [],
      "supersedes": [],
      "supersededBy": [],
      "conflictsWith": [],
      "statusGate": "adr governance"
    },
    {
      "id": "ADR-005",
      "title": "Tenant Isolation Enforcement",
      "status": "accepted",
      "decisionDate": "2026-03-02",
      "scope": "platform",
      "domain": "core",
      "path": "docs/adr/core/ADR-005-tenant-isolation.md",
      "sourceArtifact": "ADR 005 tenant isolation",
      "dependsOn": [],
      "supersedes": [],
      "supersededBy": [],
      "conflictsWith": [],
      "statusGate": "adr governance"
    },
    {
      "id": "ADR-006",
      "title": "Field-Level Permissions and Route Contracts",
      "status": "accepted",
      "decisionDate": "2026-03-02",
      "scope": "platform",
      "domain": "core",
      "path": "docs/adr/core/ADR-006-field-level-permissions.md",
      "sourceArtifact": "ADR 006 field level permissions",
      "dependsOn": [],
      "supersedes": [],
      "supersededBy": [],
      "conflictsWith": [],
      "statusGate": "adr governance"
    },
    {
      "id": "ADR-007",
      "title": "Route Contract Completion",
      "status": "accepted",
      "decisionDate": "2026-03-02",
      "scope": "platform",
      "domain": "core",
      "path": "docs/adr/core/ADR-007-route-contract-completion.md",
      "sourceArtifact": "ADR 007 route contract completion",
      "dependsOn": [],
      "supersedes": [],
      "supersededBy": [],
      "conflictsWith": [],
      "statusGate": "adr governance"
    },
    {
      "id": "ADR-008",
      "title": "Documentation Artifact Materialization",
      "status": "accepted",
      "decisionDate": "2026-03-02",
      "scope": "platform",
      "domain": "core",
      "path": "docs/adr/core/ADR-008-artifact-materialization.md",
      "sourceArtifact": "ADR 008 artifact materialization",
      "dependsOn": [],
      "supersedes": [],
      "supersededBy": [],
      "conflictsWith": [],
      "statusGate": "adr governance"
    },
    {
      "id": "ADR-009",
      "title": "Architecture Governance Baseline",
      "status": "accepted",
      "decisionDate": "2026-03-02",
      "scope": "platform",
      "domain": "core",
      "path": "docs/adr/core/ADR-009-architecture-governance-baseline.md",
      "sourceArtifact": "ADR 009 architecture governance baseline",
      "dependsOn": [],
      "supersedes": [],
      "supersededBy": [],
      "conflictsWith": [],
      "statusGate": "adr governance"
    },
    {
      "id": "ADR-010",
      "title": "Platform Stack Baseline",
      "status": "accepted",
      "decisionDate": "2026-03-02",
      "scope": "platform",
      "domain": "core",
      "path": "docs/adr/core/ADR-010-platform-stack-baseline.md",
      "sourceArtifact": "ADR 010 platform stack baseline",
      "dependsOn": [],
      "supersedes": [],
      "supersededBy": [],
      "conflictsWith": [],
      "statusGate": "adr governance"
    },
    {
      "id": "ADR-011",
      "title": "Admissions Lifecycle Erd",
      "status": "accepted",
      "decisionDate": "2026-03-02",
      "scope": "normalized engineering decision record",
      "domain": "people",
      "path": "docs/adr/people/admissions_lifecycle_erd.md",
      "sourceArtifact": "[admissions_lifecycle_erd.md](admissions_lifecycle_erd.md)",
      "dependsOn": [],
      "supersedes": [],
      "supersededBy": [],
      "conflictsWith": [],
      "statusGate": "planning corpus + ADR governance review"
    },
    {
      "id": "ADR-012",
      "title": "Agent Review Summary",
      "status": "accepted",
      "decisionDate": "2026-03-02",
      "scope": "normalized engineering decision record",
      "domain": "governance",
      "path": "docs/adr/governance/AGENT_REVIEW_SUMMARY.md",
      "sourceArtifact": "[AGENT_REVIEW_SUMMARY.md](AGENT_REVIEW_SUMMARY.md)",
      "dependsOn": [],
      "supersedes": [],
      "supersededBy": [],
      "conflictsWith": [],
      "statusGate": "planning corpus + ADR governance review"
    },
    {
      "id": "ADR-013",
      "title": "Ai Data Classification And Retention",
      "status": "accepted",
      "decisionDate": "2026-03-02",
      "scope": "normalized engineering decision record",
      "domain": "trust",
      "path": "docs/adr/trust/ai_data_classification_and_retention.md",
      "sourceArtifact": "[ai_data_classification_and_retention.md](ai_data_classification_and_retention.md)",
      "dependsOn": [],
      "supersedes": [],
      "supersededBy": [],
      "conflictsWith": [],
      "statusGate": "planning corpus + ADR governance review"
    },
    {
      "id": "ADR-014",
      "title": "Ai Moderation Telemetry Plan",
      "status": "accepted",
      "decisionDate": "2026-03-02",
      "scope": "normalized engineering decision record",
      "domain": "trust",
      "path": "docs/adr/trust/ai_moderation_telemetry_plan.md",
      "sourceArtifact": "[ai_moderation_telemetry_plan.md](ai_moderation_telemetry_plan.md)",
      "dependsOn": [],
      "supersedes": [],
      "supersededBy": [],
      "conflictsWith": [],
      "statusGate": "planning corpus + ADR governance review"
    },
    {
      "id": "ADR-015",
      "title": "Ai Policy And Tenancy Model",
      "status": "accepted",
      "decisionDate": "2026-03-02",
      "scope": "normalized engineering decision record",
      "domain": "trust",
      "path": "docs/adr/trust/ai_policy_and_tenancy_model.md",
      "sourceArtifact": "[ai_policy_and_tenancy_model.md](ai_policy_and_tenancy_model.md)",
      "dependsOn": [],
      "supersedes": [],
      "supersededBy": [],
      "conflictsWith": [],
      "statusGate": "planning corpus + ADR governance review"
    },
    {
      "id": "ADR-016",
      "title": "Api And Webhook Contract Register",
      "status": "accepted",
      "decisionDate": "2026-03-02",
      "scope": "normalized engineering decision record",
      "domain": "integration",
      "path": "docs/adr/integration/api_and_webhook_contract_register.md",
      "sourceArtifact": "[api_and_webhook_contract_register.md](api_and_webhook_contract_register.md)",
      "dependsOn": [],
      "supersedes": [],
      "supersededBy": [],
      "conflictsWith": [],
      "statusGate": "planning corpus + ADR governance review"
    },
    {
      "id": "ADR-017",
      "title": "Api Contract Registry",
      "status": "accepted",
      "decisionDate": "2026-03-02",
      "scope": "normalized engineering decision record",
      "domain": "integration",
      "path": "docs/adr/integration/api_contract_registry.md",
      "sourceArtifact": "[api_contract_registry.md](api_contract_registry.md)",
      "dependsOn": [],
      "supersedes": [],
      "supersededBy": [],
      "conflictsWith": [],
      "statusGate": "planning corpus + ADR governance review"
    },
    {
      "id": "ADR-018",
      "title": "Api Versioning And Backward Compatibility",
      "status": "accepted",
      "decisionDate": "2026-03-02",
      "scope": "normalized engineering decision record",
      "domain": "integration",
      "path": "docs/adr/integration/api_versioning_and_backward_compatibility.md",
      "sourceArtifact": "[api_versioning_and_backward_compatibility.md](api_versioning_and_backward_compatibility.md)",
      "dependsOn": [],
      "supersedes": [],
      "supersededBy": [],
      "conflictsWith": [],
      "statusGate": "planning corpus + ADR governance review"
    },
    {
      "id": "ADR-019",
      "title": "Architecture Decision Log",
      "status": "accepted",
      "decisionDate": "2026-03-02",
      "scope": "normalized engineering decision record",
      "domain": "platform",
      "path": "docs/adr/platform/ARCHITECTURE_DECISION_LOG.md",
      "sourceArtifact": "[ARCHITECTURE_DECISION_LOG.md](ARCHITECTURE_DECISION_LOG.md)",
      "dependsOn": [],
      "supersedes": [],
      "supersededBy": [],
      "conflictsWith": [],
      "statusGate": "planning corpus + ADR governance review"
    },
    {
      "id": "ADR-020",
      "title": "Architecture Design Expansion Plan",
      "status": "accepted",
      "decisionDate": "2026-03-02",
      "scope": "normalized engineering decision record",
      "domain": "platform",